SECCION,DIVISION,GRUPO,CLASE,SECCION_DESC,DIVISION_DESC,GRUPO_DESC,CLASE_DESC,GRUPO,CODIGO_GEO,PROVINCIA,MUNICIPIO,PROVINCIA_DESC,MUNICIPIO_DESC,EMPRESAS
D,D16,D16160,D161601600,"Industrias Manufactureras","Industria del tabaco","Industria del tabaco","Elaboración de productos de tabaco","010 a 049",20092507000000000,25,2507,SANTIAGO,"VILLA GONZALEZ",1
D,D16,D16160,D161601600,"Industrias Manufactureras","Industria del tabaco","Industria del tabaco","Elaboración de productos de tabaco","100 a 249",20092507000000000,25,2507,SANTIAGO,"VILLA GONZALEZ",1
D,D16,D16160,D161601600,"Industrias Manufactureras","Industria del tabaco","Industria del tabaco","Elaboración de productos de tabaco","250 o más",20092507000000000,25,2507,SANTIAGO,"VILLA GONZALEZ",1
G,G52,G52523,G525235231,"Comercio al por mayor y al por menor; reparación de vehículos automotores, motocicletas, efectos personales y enseres domésticos","Comercio al por menor, excepto el comercio de vehículos automotores y motocicletas; reparación de efectos personales y enseres domésticos","Comercio al por menor de otros productos nuevos en almacenes especializados","Venta al por menor de productos farmacéuticos y medicinales, cosméticos y artículos de tocador","001 a 009",20092507000000000,25,2507,SANTIAGO,"VILLA GONZALEZ",1
I,I63,I63630,I636306304,"Transporte, almacenamiento y comunicaciones","Actividades de transporte complementarias y auxiliares; actividades de agencias de viajes","Actividades de transporte complementarias y auxiliares; actividades de agencias de viajes","Actividades de agencias de viajes y organizadores de viajes; actividades de asistencia a turistas n.c.p.","001 a 009",20092507000000000,25,2507,SANTIAGO,"VILLA GONZALEZ",1
